Highlight,Book Title,Book Author,Amazon Book ID,Note,Color,Tags,Location Type,Location
A manager’s job is to transform his glaring deficiency into a strength by finding the best person to fill it and trusting him to do the job.,Managing Humans: Biting and Humorous Tales of a Software Engineering Manager,Michael Lopp,B01J53IE1O,,yellow,,location,332
"A manager’s job is to take what skills they have, the ones that got them promoted, and figure out how to make them scale. They do this by building a team that accentuates their strengths and, more importantly, reinforces where they are weak.",Managing Humans: Biting and Humorous Tales of a Software Engineering Manager,Michael Lopp,B01J53IE1O,,yellow,,location,328
"As such, an origin story acts as a bridge between your concept story and your usage story—bridging the gap between the concept of a product or service and the actual usage of it. It’s where and when potential customers not only see what they can do with a product, but also how they can take an action with it.",The User's Journey: Storymapping Products That People Love,"Donna Lichaw, Eva Lotta-Lamm",B01D95U8UO,,yellow,,location,823
"Apple solved a problem that people didn’t know they had. As such, the 2007 keynote, as well as the device itself, not only had to tell the world what their problem was, but also show what the problem was and highlight how the solution could look and function.",The User's Journey: Storymapping Products That People Love,"Donna Lichaw, Eva Lotta-Lamm",B01D95U8UO,,yellow,,location,545
"In Badass: Making Users Awesome, Kathy Sierra argues that creating successful products is not about what features you build—it’s about how badass you make your user on the other end feel. It’s not about what your product can do, but instead about what your users can do if they use your product.",The User's Journey: Storymapping Products That People Love,"Donna Lichaw, Eva Lotta-Lamm",B01D95U8UO,,yellow,,location,441
"Some of the things that your team should agree upon before starting will include the following: The initial limits for WIP and any policies that can be in place in order to change those limits or break them temporarily. The process for prioritizing or selecting the features that needs to be done. The policies for the way you will classify your services. This could be things like fixed delivery date, expedite, or standard. Determine if you need to provide estimates. And when the team has to choose the work they will do, how will they make this selection. How often reviews should be done to ensure the system is still working.",Kanban: Workflow Visualized: An Expert's Guide,Gary Metcalfe,B07MM6GDVG,,yellow,,location,210
"A common problem with measurements is that they can change from being the means to control the success of a project to an end in itself. In Seeing like a state, James C. Scott warns about the conflict between two levels of metrics: the ones that provide understanding and control to people outside the process being measured, and the ones that are important for the people inside, affected by the process.",Impact Mapping: Making a big impact with software products and projects,Gojko Adzic,B009KWDKVA,,yellow,,location,356
"In How to Measure Anything, Douglas Hubbard warns about a common psychological tendency to track what is easy to measure instead of what can inform good decisions. Hubbard says that information is valuable if it reduces uncertainty about decisions, and that the “value of measuring a variable is often inversely proportional to the attention it gets”.",Impact Mapping: Making a big impact with software products and projects,Gojko Adzic,B009KWDKVA,,yellow,,location,349
"Based on a seven year long research of companies across the European Union, John McManus and Trevor Wood-Harper list the following as the top five key reasons why IT projects fail: Business reasons Business strategy superseded Business processes change (poor alignment) Poor requirements management Business benefits not clearly communicated or overstated",Impact Mapping: Making a big impact with software products and projects,Gojko Adzic,B009KWDKVA,,yellow,,location,307
"By visually grouping together different deliverables that could contribute to the same impact, maps allow us to spot over-complicated solutions and prevent over-engineering. They facilitate thinking about alternatives, helping delivery teams come up with simpler, cheaper and faster alternative deliverables that achieve the desired effect. Because of this, impact maps make it is easy to argue that more complex solutions should be discarded or at least postponed until simpler suggestions are proven wrong.",Impact Mapping: Making a big impact with software products and projects,Gojko Adzic,B009KWDKVA,,yellow,,location,290
"To use impact maps for roadmap management, you need: agreement that your aim is to achieve a business goal, not deliver pre-set scope frequent, iterative releases to measure progress agreement on metrics that express stakeholder expectations for the central business goal",Impact Mapping: Making a big impact with software products and projects,Gojko Adzic,B009KWDKVA,,yellow,,location,280
"Once a deliverable is shipped, we can measure the actual changes in actors' behaviour and the impact on the overall objective. We can then re-evaluate our strategy and decide whether to continue working on the same part of the map or move on to something else.",Impact Mapping: Making a big impact with software products and projects,Gojko Adzic,B009KWDKVA,,yellow,,location,278
"An impact map communicates scope, goals and priorities, but also assumptions on two levels. The first is that a deliverable will cause a change in behaviour of an actor, produce an impact. The second is that once the impact is achieved, the relevant actor will contribute to the overall objectives.",Impact Mapping: Making a big impact with software products and projects,Gojko Adzic,B009KWDKVA,,yellow,,location,275
"Impact maps bridge the two worlds: they facilitate strategic planning and thinking to create a big-picture view focused on key business objectives, but also facilitate learning through delivery and help us manage project roadmaps. They represent and organise delivery scope in a way that is easy to evolve, reprioritise, grow and shrink as necessary to react to changed market opportunities or new knowledge.",Impact Mapping: Making a big impact with software products and projects,Gojko Adzic,B009KWDKVA,,yellow,,location,256
"An impact map puts all the deliverables in the context of the impacts that they are supposed to support. This helps with breaking deliverables down into independent chunks that provide clear business value, and helps us launch something valuable sooner. A clear hierarchy allows us to group related deliverables, compare them and avoid over-investing in less important actors or impacts. It also helps us to throw out deliverables that do not really contribute to any important impact for a particular goal. Finally, by connecting deliverables to impacts and goals, a map shows the chain of reasoning that led to a feature suggestion, visualising the assumptions of stakeholders. This allows us to scrutinise those decisions better and re-evaluate them as new information becomes available through delivery.",Impact Mapping: Making a big impact with software products and projects,Gojko Adzic,B009KWDKVA,,yellow,,location,212
"Once we have the first three questions answered, we can talk about scope. The third level of an impact map answers the following question: What can we do, as an organisation or a delivery team, to support the required impacts? These are the deliverables, software features and organisational activities.",Impact Mapping: Making a big impact with software products and projects,Gojko Adzic,B009KWDKVA,,yellow,,location,206
"Impacts are not product features. Avoid listing software ideas here, focus on business activities.",Impact Mapping: Making a big impact with software products and projects,Gojko Adzic,B009KWDKVA,,yellow,,location,201
The second level of an impact map sets the actors in the perspective of our business goal. It answers the following questions: How should our actors' behaviour change? How can they help us to achieve the goal? How can they obstruct or prevent us from succeeding? These are the impacts that we're trying to create.,Impact Mapping: Making a big impact with software products and projects,Gojko Adzic,B009KWDKVA,,yellow,,location,188
The first level of an impact map provides answers to the following questions: Who can produce the desired effect? Who can obstruct it? Who are the consumers or users of our product? Who will be impacted by it? These are the actors who can influence the outcome.,Impact Mapping: Making a big impact with software products and projects,Gojko Adzic,B009KWDKVA,,yellow,,location,169
"Goals should not be about building products or delivering project scope. They should explain why such a thing would be useful. Goals should present the problem to be solved, not the solution. Avoid design constraints in a goal definition.",Impact Mapping: Making a big impact with software products and projects,Gojko Adzic,B009KWDKVA,,yellow,,location,162
"The purpose of a goal definition is to allow the delivery organisation and business sponsors to re-evaluate the plan as new information becomes available. For this reason, good goals tend to be SMART: Specific, Measurable, Action-oriented, Realistic and Timely.",Impact Mapping: Making a big impact with software products and projects,Gojko Adzic,B009KWDKVA,,yellow,,location,160
"Assumptions validated by consistent data from actual experiments enable the creation of real value. An impact map connects candidate causes with desired effects. It is a map of assumptions connecting causes and effects. It helps you to find the right questions, which is much more difficult than finding good answers.",Impact Mapping: Making a big impact with software products and projects,Gojko Adzic,B009KWDKVA,,yellow,,location,63
"Agile approaches use ‘working software’ as this visualization by rapidly implementing small collections of user stories which non-software disciplines can provide feedback on. However, while working software can validate choices, it does not help a lot with discovering and selecting those sets of user stories whose implementation will delight the people who will use the solution to achieve the overall purpose.",Impact Mapping: Making a big impact with software products and projects,Gojko Adzic,B009KWDKVA,,yellow,,location,37
"If a product milestone or project succeeds in delivering the expected business goal, it is a success from a business perspective, even if the delivered scope ends up being different from what was originally envisaged.",Impact Mapping: Making a big impact with software products and projects,Gojko Adzic,B009KWDKVA,,yellow,,location,155
disparate perspectives and even vocabularies dominating each discipline make unambiguous communication difficult.,Impact Mapping: Making a big impact with software products and projects,Gojko Adzic,B009KWDKVA,,yellow,,location,35
Baseline metrics are useful for narrowing the solution space that you explore in order to accomplish your investment goals. They are also useful for identifying when you should pause pursuing your goals and instead invest in platform quality.,An Elegant Puzzle: Systems of Engineering Management,Will Larson,B07QYCHJ7V,,yellow,,location,881
"There are two particularly interesting kinds of goals: investments and baselines. Investments describe a future state that you want to reach, and baselines describe aspects of the present that you want to preserve.",An Elegant Puzzle: Systems of Engineering Management,Will Larson,B07QYCHJ7V,,yellow,,location,872
"The two tests of an effective goal are whether someone who doesn’t know much about an area can get a feel for a goal’s degree of difficulty, and whether afterward they can evaluate if it was successfully achieved.",An Elegant Puzzle: Systems of Engineering Management,Will Larson,B07QYCHJ7V,,yellow,,location,869
Good goals are a composition of four specific kinds of numbers: A target states where you want to reach. A baseline identifies where you are today. A trend describes the current velocity. A time frame sets bounds for the change.,An Elegant Puzzle: Systems of Engineering Management,Will Larson,B07QYCHJ7V,,yellow,,location,862
"A good vision is composed of: Vision statement: A one- or two-sentence aspirational statement to summarize the rest of the document. This is your core speaking point, which you will repeat at each meeting, planning period, and strategy review. It shouldn’t try to capture every detail of your vision, but it does need to memorably evoke your vision effectively. Value proposition: How will you be valuable to your users and to your company? What kinds of success will you enable them to achieve? There is a sequencing question of whether you should start with capabilities (the next bullet) and reason into value proposition or do the opposite, but I’ve found that starting from your users leads to visions that are both more ambitious and more grounded. Capabilities: What capabilities will the product, platform, or team need in order to deliver on your value proposition? Will it need to support multiple independent business lines? Will it need to deliver against the disparate needs of several distinct customer cohorts? Solved constraints: What are the constraints that you’re limited by today, but that in the future you’ll no longer be constrained by? For example, if you’re currently “spending into” developer velocity, perhaps in the future you’ll be able to achieve significant developer velocity while also maintaining low costs. Future constraints: What are the constraints that you expect to encounter in this wonderful future? Hopefully, these new constraints will be things that are easy to adjust, like funding or hiring. Reference materials: Link all the existing plans, metrics, updates, references, and documents into an appendix for those who want to understand more of the thinking that went into the vision. This allows you to shed complexity from your vision document without sacrificing context. Narrative: Once you’ve written the previous sections, the last step of writing a compelling vision is to synthesize all those details into a short—maybe one-page—narrative that serves as an easy-to-digest summary. In your final document, this is probably the second section, following the statement.",An Elegant Puzzle: Systems of Engineering Management,Will Larson,B07QYCHJ7V,,yellow,,location,815
"If strategies describe the harsh trade-offs necessary to overcome a particular challenge, then visions describe a future in which those trade-offs are no longer mutually exclusive. An effective vision helps folks think beyond the constraints of their local maxima, and lightly aligns progress without requiring tight centralized coordination.",An Elegant Puzzle: Systems of Engineering Management,Will Larson,B07QYCHJ7V,,yellow,,location,810
"When you apply your guiding policies to your diagnosis, you get your actions. Folks are often comfortable with hard decisions in the abstract, but struggle to translate policies into the specific steps to implement them.",An Elegant Puzzle: Systems of Engineering Management,Will Larson,B07QYCHJ7V,,yellow,,location,795
"The diagnosis is a theory describing the challenge at hand. It calls out the factors and constraints that define the challenge, and at its core is a very thorough problem statement.",An Elegant Puzzle: Systems of Engineering Management,Will Larson,B07QYCHJ7V,,yellow,,location,781
"A strategy recommends specific actions that address a given challenge’s constraints. A structure that I’ve found extremely effective13 is described in Good Strategy/Bad Strategy by Richard Rumelt,14 and has three sections: diagnosis, policies, and actions.",An Elegant Puzzle: Systems of Engineering Management,Will Larson,B07QYCHJ7V,,yellow,,location,777
Strategies are grounded documents which explain the trade-offs and actions that will be taken to address a specific challenge. Visions are aspirational documents that enable individuals who don’t work closely together to make decisions that fit together cleanly.,An Elegant Puzzle: Systems of Engineering Management,Will Larson,B07QYCHJ7V,,yellow,,location,767
"The elements that I’ve found effective for solution validation are: Write a customer letter. Write the launch announcement that you would send after finishing the solution. Are you able to write something exciting, useful, and real? It’s much more useful to test it against your actual users than to rely on your intuition. Identify prior art. How do peers across the industry approach this problem? The fact that others have solved a problem in a certain way doesn’t mean that it’s a great way, but it does at least mean it’s possible. A mild caveat: it’s better to rely on people you have some connection to instead of on conference talks and such, since there is a surprisingly large amount of misinformation out there. Find reference users. Can you find users who are willing to be the first users for the solution? If you can’t, you should be skeptical whether what you’re building is worthwhile. Prefer experimentation over analysis. It’s far more reliable to get good at cheap validation than it is to get great at consistently picking the right solution.",An Elegant Puzzle: Systems of Engineering Management,Will Larson,B07QYCHJ7V,,yellow,,location,732
"Users’ pain. What are the problems that your users experience? It’s useful to go broad via survey mechanisms, as well as to go deep by interviewing a smaller set of interesting individuals across different user segments. Users’ purpose. What motivates your users to engage with your systems? How can you better enable users to accomplish their goals?",An Elegant Puzzle: Systems of Engineering Management,Will Larson,B07QYCHJ7V,,yellow,,location,686
"The first phase of a planning cycle is exploring the different problems that you could pick to solve. It’s surprisingly common to skip this phase, but that, unsurprisingly, leads to inertia-driven local optimization. Taking the time to evaluate which problem to solve is one of the best predictors I’ve found of a team’s long-term performance.",An Elegant Puzzle: Systems of Engineering Management,Will Larson,B07QYCHJ7V,,yellow,,location,683
"These dimensions kind of intuitively make sense as measures of productivity, but let’s see if we can model them into a system that we can use to reason about developer productivity: Pull requests are converted into ready commits based on our code review rate. Ready commits convert into deployed commits at deploy rate. Deployed commits convert into incidents at defect rate. Incidents are remediated into reverted commits at recovery rate. Reverted commits are debugged into new pull requests at debug rate. Linking these pieces together, we see a feedback loop, in which the system’s downstream behavior impacts its upstream behavior. With a sufficiently high defect rate or slow recovery rate, you could easily see a world where each deploy leaves you even further behind.",An Elegant Puzzle: Systems of Engineering Management,Will Larson,B07QYCHJ7V,,yellow,,location,639
four measures of developer velocity: Delivery lead time is the time from the creation of code to its use in production. Deployment frequency is how often you deploy code. Change fail rate is how frequently changes fail. Time to restore service is the time spent recovering from defects.,An Elegant Puzzle: Systems of Engineering Management,Will Larson,B07QYCHJ7V,,yellow,,location,632
"the idea of organizational debt. This is the organizational sibling of technical debt, and it represents things like biased interview processes and inequitable compensation mechanisms. These are systemic problems that are preventing your organization from reaching its potential. Like technical debt, these risks linger because they are never the most pressing problem. Until that one fateful moment when they are.",An Elegant Puzzle: Systems of Engineering Management,Will Larson,B07QYCHJ7V,,yellow,,location,524
"Finally, a related antipattern is the gatekeeper pattern. Having humans who perform gatekeeping activities creates very odd social dynamics, and is rarely a great use of a human’s time. When at all possible, build systems with sufficient isolation that you can allow most actions to go forward. And when they do occasionally fail, make sure that they fail with a limited blast radius.",An Elegant Puzzle: Systems of Engineering Management,Will Larson,B07QYCHJ7V,,yellow,,location,510
"if you can keep your interfaces generic, then you are able to skip the migration phase of system re-implementation, which tends to be the longest and trickiest phase, and you can iterate much more quickly and maintain fewer concurrent versions. There is absolutely a cost to maintaining this extra layer of indirection, but if you’ve already rewritten a system twice, take the time to abstract the interface as part of the third rewrite and thank yourself later.",An Elegant Puzzle: Systems of Engineering Management,Will Larson,B07QYCHJ7V,,yellow,,location,506
"Finally, the one thing that I’ve found at companies with very few interruptions and have observed almost nowhere else: really great, consistently available documentation. It’s probably even harder to bootstrap documentation into a non-documenting company than it is to bootstrap unit tests into a non-testing company, but the best solution to frequent interruptions I’ve seen is a culture of documentation, documentation reading, and a documentation search that actually works.",An Elegant Puzzle: Systems of Engineering Management,Will Larson,B07QYCHJ7V,,yellow,,location,496
the real productivity killer is not system rewrites but the migrations that follow those rewrites. Poorly designed migrations expand the consequences of this rewrite loop from the individual teams supporting the systems to the entire surrounding organization.,An Elegant Puzzle: Systems of Engineering Management,Will Larson,B07QYCHJ7V,,yellow,,location,456
"For every additional order of magnitude of engineers, you need to design and maintain a new layer of management. For every ~10 engineers, you need an additional team, which requires more coordination.14 Each engineer means more commits and deployments per day, creating load on your development tools. Most outages are caused by deployments, so more deployments drive more outages, which in turn require incident management, mitigations, and postmortems. Having more engineers leads to more specialized teams and systems, which require increasingly small on-call rotations so that your on-call engineers have enough system context to debug and resolve production issues. Consequently, relative time invested in on-call goes up.",An Elegant Puzzle: Systems of Engineering Management,Will Larson,B07QYCHJ7V,,yellow,,location,427
"The other approach that I’ve seen work well is to rotate individuals for a fixed period into an area that needs help. The fixed duration allows them to retain their identity and membership in their current team, giving their full focus to helping out, rather than splitting their focus between performing the work and finding membership in the new team. This is also a safe way to measure how much slack the team really has!",An Elegant Puzzle: Systems of Engineering Management,Will Larson,B07QYCHJ7V,,yellow,,location,385
"Shifting scope works better than moving people because it avoids re-gelling costs, and it preserves system behavior. Preserving behavior keeps your existing mental model intact, and if it doesn’t work out, you can always revert a workload change with less disruption than would be caused by a staffing change.",An Elegant Puzzle: Systems of Engineering Management,Will Larson,B07QYCHJ7V,,yellow,,location,383
"My rule of thumb is that it takes eight engineers on a team to support a two-tier on-call rotation, so I’m generally reluctant to move any team with membership below that line. However, fixed costs come in many other varieties: “keeping the lights on” work, precommitted contracts, support questions from other teams, etc.",An Elegant Puzzle: Systems of Engineering Management,Will Larson,B07QYCHJ7V,,yellow,,location,358
"Fundamentally, I believe that sustained productivity comes from high-performing teams, and that disassembling a high-performing team leads to a significant loss of productivity, even if the members are fully retained. In this worldview, high-performing teams are sacred, and I’m quite hesitant to disassemble them.",An Elegant Puzzle: Systems of Engineering Management,Will Larson,B07QYCHJ7V,,yellow,,location,344
"Adding new individuals to a team disrupts that team’s gelling process, so I’ve found it much easier to have rapid growth periods for any given team, followed by consolidation/gelling periods during which the team gels. The organization will never stop growing, but each team will.",An Elegant Puzzle: Systems of Engineering Management,Will Larson,B07QYCHJ7V,,yellow,,location,329
