Highlight,Book Title,Book Author,Amazon Book ID,Note,Color,Tags,Location Type,Location
"Since all pages will have the same basic layout (or at the very least, most pages), we’ll create a way to render our templates within the same layout on every page. All the HTML boilerplate required by every page can go into this layout, and we can keep our templates thin, with just the content that makes each page unique. Go doesn’t support layouts directly out of the box, so we’ll need to write our own way of handling layouts. To do this we’ll create a layout file. In this file, we’ll write our layout HTML, and then add a function call {{ yield }} where we want our content to be rendered. We’ll be creating the yield function ourselves, and while it has no special meaning in and of itself, it’s a common term used in a variety of programming languages to defer control to other code, so it makes sense as a function name:","Level Up Your Web Apps With Go: Performance, Concurrency, Scalability",Mal Curtis,B00X6GVZ40,,yellow,,location,1267
"Go’s FileServer is reading the metadata from the file and adding the header. If a request comes in with an If-Modified-Since header that is on or before this date, Go will return a 304 Not Modified and no body content. This allows the browser to cache a file and only request files if they’ve been updated. Your browser will handle these headers, sending an If-Modified-Since date if it’s seen the file before and received a Last-Modified header. If it receives a 304 response, it just serves up the file from its cache. Fewer data has to be transferred, and your application has to do less work.","Level Up Your Web Apps With Go: Performance, Concurrency, Scalability",Mal Curtis,B00X6GVZ40,,yellow,,location,1181
"Last-Modified headers aren’t just for static files. If you design your service well, you can use the same process to say that data has yet to be updated since a given time. If a user has data that’s still valid, you can return a 304 and the page doesn’t have to be rerendered, the data won’t need to be fetched from the database, and everything is superfast for the user:","Level Up Your Web Apps With Go: Performance, Concurrency, Scalability",Mal Curtis,B00X6GVZ40,,yellow,,location,1186
"Because we know we’ll be changing the persistent store layer from file to database, we’re going to implement our UserStore object as an interface rather than as a single concrete implementation.","Level Up Your Web Apps With Go: Performance, Concurrency, Scalability",Mal Curtis,B00X6GVZ40,,yellow,,location,1703
"The Go time package has predefined constants for time up to an hour, but not for days or longer periods. There are several reasons for this, such as days being able to transition across daylight savings, to aspects such as leap seconds. The underlying reason is the same: the length of a day changes, so there is no constant value that represents a day. Go does provide plenty of tools to deal with dates that have more context than a simple duration.","Level Up Your Web Apps With Go: Performance, Concurrency, Scalability",Mal Curtis,B00X6GVZ40,,yellow,,location,1883
Get humans out of the deployment business. Figure out how to get to ten deploys a day.”,"The Phoenix Project: A Novel About IT, DevOps, and Helping Your Business Win","Gene Kim, Kevin  Behr, and George Spafford",B00AZRBLHO,,yellow,,location,4594
"You need to get everything in version control. Everything. Not just the code, but everything required to build the environment. Then you need to automate the entire environment creation process. You need a deployment pipeline where you can create test and production environments, and then deploy code into them, entirely on-demand. That’s how you reduce your setup times and eliminate errors, so you can finally match whatever rate of change Development sets the tempo at.”","The Phoenix Project: A Novel About IT, DevOps, and Helping Your Business Win","Gene Kim, Kevin  Behr, and George Spafford",B00AZRBLHO,,yellow,,location,4588
"until code is in production, no value is actually being generated, because it’s merely WIP stuck in the system. He kept reducing the batch size, enabling fast feature flow.","The Phoenix Project: A Novel About IT, DevOps, and Helping Your Business Win","Gene Kim, Kevin  Behr, and George Spafford",B00AZRBLHO,,yellow,,location,4578
"“a ‘change’ is any activity that is physical, logical, or virtual to applications, databases, operating systems, networks, or hardware that could impact services being delivered.”","The Phoenix Project: A Novel About IT, DevOps, and Helping Your Business Win","Gene Kim, Kevin  Behr, and George Spafford",B00AZRBLHO,,yellow,,location,1179
"“Properly elevating preventive work is at the heart of programs like Total Productive Maintenance, which has been embraced by the Lean Community. TPM insists that we do whatever it takes to assure machine availability by elevating maintenance.","The Phoenix Project: A Novel About IT, DevOps, and Helping Your Business Win","Gene Kim, Kevin  Behr, and George Spafford",B00AZRBLHO,,yellow,,location,3278
"if a resource is ninety percent busy, the wait time is ‘ninety percent divided by ten percent’, or nine hours. In other words, our task would wait in queue nine times longer than if the resource were fifty percent idle.”","The Phoenix Project: A Novel About IT, DevOps, and Helping Your Business Win","Gene Kim, Kevin  Behr, and George Spafford",B00AZRBLHO,,yellow,,location,3645
"A key causal factor for vehicle breakdowns is failure to change the oil. So, to mitigate that risk, you’d create an SLA for vehicle operations to change the oil every five thousand miles.” Obviously enjoying himself, he keeps explaining, “Our organizational key performance indicator (KPI) is on-time delivery. So to achieve it, you would create a new forward-looking KPI of, say, the percentage of vehicles that have had their required oil changes performed. “After all, if only fifty percent of our vehicles are complying with the required maintenance policies, it’s a good bet that in the near future, our on-time delivery KPIs are going to take a dive,","The Phoenix Project: A Novel About IT, DevOps, and Helping Your Business Win","Gene Kim, Kevin  Behr, and George Spafford",B00AZRBLHO,,yellow,,location,3936
"“Stop focusing on the deployment target rate. Business agility is not just about raw speed. It’s about how good you are at detecting and responding to changes in the market and being able to take larger and more calculated risks. It’s about continual experimentation, like Scott Cook did at Intuit, where they did over forty experiments during the peak tax filing season to figure out how to maximize customer conversion rates. During the peak tax filing season!","The Phoenix Project: A Novel About IT, DevOps, and Helping Your Business Win","Gene Kim, Kevin  Behr, and George Spafford",B00AZRBLHO,,yellow,,location,4597
"Any improvement made after the bottleneck is useless, because it will always remain starved, waiting for work from the bottleneck. And any improvements made before the bottleneck merely results in more inventory piling up at the bottleneck.”","The Phoenix Project: A Novel About IT, DevOps, and Helping Your Business Win","Gene Kim, Kevin  Behr, and George Spafford",B00AZRBLHO,,yellow,,location,1333
"“What that graph says is that everyone needs idle time, or slack time. If no one has slack time, WIP gets stuck in the system. Or more specifically, stuck in queues, just waiting.”","The Phoenix Project: A Novel About IT, DevOps, and Helping Your Business Win","Gene Kim, Kevin  Behr, and George Spafford",B00AZRBLHO,,yellow,,location,3656
"kanban board, among many other things, is one of the primary ways our manufacturing plants schedule and pull work through the system. It makes demand and WIP visible, and is used to signal upstream and downstream stations.","The Phoenix Project: A Novel About IT, DevOps, and Helping Your Business Win","Gene Kim, Kevin  Behr, and George Spafford",B00AZRBLHO,,yellow,,location,3507
"“every work center is made up of four things: the machine, the man, the method, and the measures.","The Phoenix Project: A Novel About IT, DevOps, and Helping Your Business Win","Gene Kim, Kevin  Behr, and George Spafford",B00AZRBLHO,,yellow,,location,3223
“A great team doesn’t mean that they had the smartest people. What made those teams great is that everyone trusted one another.,"The Phoenix Project: A Novel About IT, DevOps, and Helping Your Business Win","Gene Kim, Kevin  Behr, and George Spafford",B00AZRBLHO,,yellow,,location,2802
"“Goldratt taught us that in most plants, there are a very small number of resources, whether it’s men, machines, or materials, that dictates the output of the entire system. We call this the constraint—or bottleneck.","The Phoenix Project: A Novel About IT, DevOps, and Helping Your Business Win","Gene Kim, Kevin  Behr, and George Spafford",B00AZRBLHO,,yellow,,location,2512
"Studies have shown that practicing five minutes daily is better than practicing once a week for three hours. And if you want to create a genuine culture of improvement, you must create those habits.”","The Phoenix Project: A Novel About IT, DevOps, and Helping Your Business Win","Gene Kim, Kevin  Behr, and George Spafford",B00AZRBLHO,,yellow,,location,3289
"“The First Way helps us understand how to create fast flow of work as it moves from Development into IT Operations, because that’s what’s between the business and the customer. The Second Way shows us how to shorten and amplify feedback loops, so we can fix quality at the source and avoid rework. And the Third Way shows us how to create a culture that simultaneously fosters experimentation, learning from failure, and understanding that repetition and practice are the prerequisites to mastery.”","The Phoenix Project: A Novel About IT, DevOps, and Helping Your Business Win","Gene Kim, Kevin  Behr, and George Spafford",B00AZRBLHO,,yellow,,location,1355
"At this level, I care more about the integrity of the process, not so much about the actual changes.”","The Phoenix Project: A Novel About IT, DevOps, and Helping Your Business Win","Gene Kim, Kevin  Behr, and George Spafford",B00AZRBLHO,,yellow,,location,1528
"“Unlike the other categories of work, unplanned work is recovery work, which almost always takes you away from your goals. That’s why it’s so important to know where your unplanned work is coming from.”","The Phoenix Project: A Novel About IT, DevOps, and Helping Your Business Win","Gene Kim, Kevin  Behr, and George Spafford",B00AZRBLHO,,yellow,,location,2491
"“Remember, outcomes are what matter—not the process, not controls, or, for that matter, what work you complete.”","The Phoenix Project: A Novel About IT, DevOps, and Helping Your Business Win","Gene Kim, Kevin  Behr, and George Spafford",B00AZRBLHO,,yellow,,location,2555
"“Unplanned work has another side effect. When you spend all your time firefighting, there’s little time or energy left for planning. When all you do is react, there’s not enough time to do the hard mental work of figuring out whether you can accept new work.","The Phoenix Project: A Novel About IT, DevOps, and Helping Your Business Win","Gene Kim, Kevin  Behr, and George Spafford",B00AZRBLHO,,yellow,,location,2990
"You must figure out how to control the release of work into IT Operations and, more importantly, ensure that your most constrained resources are doing only the work that serves the goal of the entire system, not just one silo.","The Phoenix Project: A Novel About IT, DevOps, and Helping Your Business Win","Gene Kim, Kevin  Behr, and George Spafford",B00AZRBLHO,,yellow,,location,1353
"“Metaphors like oil changes help people make that connection. Preventive oil changes and vehicle maintenance policies are like preventive vendor patches and change management policies. By showing how IT risks jeopardize business performance measures, you can start making better business decisions.","The Phoenix Project: A Novel About IT, DevOps, and Helping Your Business Win","Gene Kim, Kevin  Behr, and George Spafford",B00AZRBLHO,,yellow,,location,3945
‘Improving daily work is even more important than doing daily work.’,"The Phoenix Project: A Novel About IT, DevOps, and Helping Your Business Win","Gene Kim, Kevin  Behr, and George Spafford",B00AZRBLHO,,yellow,,location,3280
"every stage of the agile development process, you not only have shippable code, but a working environment it can deploy into!”","The Phoenix Project: A Novel About IT, DevOps, and Helping Your Business Win","Gene Kim, Kevin  Behr, and George Spafford",B00AZRBLHO,,yellow,,location,4604
"“It’s like the free puppy,” I continue. “It’s not the upfront capital that kills you, it’s the operations and maintenance on the back end.” Chris cracks up. “Yes, exactly! They’ll say, ‘The puppy can’t quite do everything we need. Can you train it to fly airplanes? It’s just a simple matter of coding, right?’","The Phoenix Project: A Novel About IT, DevOps, and Helping Your Business Win","Gene Kim, Kevin  Behr, and George Spafford",B00AZRBLHO,,yellow,,location,2311
"Resilience engineering tells us that we should routinely inject faults into the system, doing them frequently, to make them less painful.","The Phoenix Project: A Novel About IT, DevOps, and Helping Your Business Win","Gene Kim, Kevin  Behr, and George Spafford",B00AZRBLHO,,yellow,,location,3282
"“Eliyahu M. Goldratt, who created the Theory of Constraints, showed us how any improvements made anywhere besides the bottleneck are an illusion.","The Phoenix Project: A Novel About IT, DevOps, and Helping Your Business Win","Gene Kim, Kevin  Behr, and George Spafford",B00AZRBLHO,,yellow,,location,1332
"‘technical debt’ that is not being paid down. It comes from taking shortcuts, which may make sense in the short-term. But like financial debt, the compounding interest costs grow over time. If an organization doesn’t pay down its technical debt, every calorie in the organization can be spent just paying interest, in the form of unplanned work.”","The Phoenix Project: A Novel About IT, DevOps, and Helping Your Business Win","Gene Kim, Kevin  Behr, and George Spafford",B00AZRBLHO,,yellow,,location,2981
We need to create a culture that reinforces the value of taking risks and learning from failure and the need for repetition and practice to create mastery.,"The Phoenix Project: A Novel About IT, DevOps, and Helping Your Business Win","Gene Kim, Kevin  Behr, and George Spafford",B00AZRBLHO,,yellow,,location,5103
"some IT controls he holds near and dear aren’t needed, because other parts of the organization are adequately mitigating those risks.","The Phoenix Project: A Novel About IT, DevOps, and Helping Your Business Win","Gene Kim, Kevin  Behr, and George Spafford",B00AZRBLHO,,yellow,,location,3918
"“Mike Rother says that it almost doesn’t matter what you improve, as long as you’re improving something. Why? Because if you are not improving, entropy guarantees that you are actually getting worse, which ensures that there is no path to zero errors, zero work-related accidents, and zero loss.”","The Phoenix Project: A Novel About IT, DevOps, and Helping Your Business Win","Gene Kim, Kevin  Behr, and George Spafford",B00AZRBLHO,,yellow,,location,3283
This kind of function is called a constructor because it creates and initializes the properties of the Object on 'construction' of it.,"Javascript: Learn Javascript In A DAY! - The Ultimate Crash Course to Learning the Basics of the Javascript Programming Language In No Time (Javascript, ... JSON, Javascript Development Book 1)","Acodemy, Javascript, and Javascript Programming",B00SW1YQYK,,yellow,,location,1829
"class constructor would define the properties namely name, breed and age so we don't have to explicitly define them every time we want to create a dog object.","Javascript: Learn Javascript In A DAY! - The Ultimate Crash Course to Learning the Basics of the Javascript Programming Language In No Time (Javascript, ... JSON, Javascript Development Book 1)","Acodemy, Javascript, and Javascript Programming",B00SW1YQYK,,yellow,,location,1821
It’s not just properties but you can also assign functions known as methods to objects. A method is declared in the same way for an object as is a property.,"Javascript: Learn Javascript In A DAY! - The Ultimate Crash Course to Learning the Basics of the Javascript Programming Language In No Time (Javascript, ... JSON, Javascript Development Book 1)","Acodemy, Javascript, and Javascript Programming",B00SW1YQYK,,yellow,,location,1860
an Object is an instance of a class.,"Javascript: Learn Javascript In A DAY! - The Ultimate Crash Course to Learning the Basics of the Javascript Programming Language In No Time (Javascript, ... JSON, Javascript Development Book 1)","Acodemy, Javascript, and Javascript Programming",B00SW1YQYK,,yellow,,location,1767
"True accomplishment seems imperfect If you seek perfection, you will achieve nothing. If your code is of service, let it serve and move to the next challenge.",Tao Te Programming,Patrick Burns and Bill Alpert,B00APEV988,,yellow,,location,1301
"Testing Principles Test for the right answer, rather than testing for not a specific wrong answer (2+2 == 4 is a good test, 2+2 != 5 is a bad test) Test for the problem, not for the implementation Testing can show the presence of bugs, but not their absence. --- Edsger Dijkstra quoted by Jon Bentley",Tao Te Programming,Patrick Burns and Bill Alpert,B00APEV988,,yellow,,location,1243
The full exercise of learning a new language is more than just learning the rules and the vocabulary --- it is getting the spirit of the language.,Tao Te Programming,Patrick Burns and Bill Alpert,B00APEV988,,yellow,,location,1292
"There is no best way, only various forms of wrong. The path that can be told is not the immortal Path",Tao Te Programming,Patrick Burns and Bill Alpert,B00APEV988,,yellow,,location,1315
"If you are going to break backwards compatibility, it is sometimes best to go all out and change everything you want to change in one go. Signal this with a major version change (e.g., 1.xx to 2.00) or some other visible sign that there is a large break.",Tao Te Programming,Patrick Burns and Bill Alpert,B00APEV988,,yellow,,location,1194
"Deprecation Here you gradually move things towards the door before you give them one last kick. Version 2 throws a warning saying, ""This is deprecated, do xxx instead"". Version 3 throws an error saying, ""This is defunct, do xxx instead"" . The upside is that you can side-step growing complexity while gently moving your users on to better ways. The downside is that you need patience. And, of course, some users won't take the hint until they are forced to move to the new scheme.",Tao Te Programming,Patrick Burns and Bill Alpert,B00APEV988,,yellow,,location,1189
The two types of test to start with are: common cases corner cases,Tao Te Programming,Patrick Burns and Bill Alpert,B00APEV988,,yellow,,location,1227
"build prototypes. Whenever you have a new thing to do, explore what lots of solutions might look like. Children experiment to figure out how their world works. You are a child in the world of your new project.",Tao Te Programming,Patrick Burns and Bill Alpert,B00APEV988,,yellow,,location,1114
P. G. Wodehouse revised his stories by pinning each page to the wall. The height of the page corresponded to how good he thought it was. His revision strategy consisted of improving the lowest page on the wall so that it could be pinned higher up.,Tao Te Programming,Patrick Burns and Bill Alpert,B00APEV988,,yellow,,location,1166
What makes a good example? Qualities include: simplicity depth surprise You want something quick to understand yet a non-trivial use of the code. Two examples can be three times better than either. It's very much a bonus if users can reproduce the example themselves.,Tao Te Programming,Patrick Burns and Bill Alpert,B00APEV988,,yellow,,location,1206
"Do a premortem when you start a major project. This is a game where the supposition is that the project has failed (at some indeterminate time in the future). The object of the game is to state why it is that the project failed. Our optimism bias is a problem. Suppose you asked, ""What is wrong with the project?"" The answer would be, ""Nothing, it's fine."" But with a premortem we dictate the death of the project. Now it becomes okay --- both psychologically and socially --- to come up with weaknesses of the project.",Tao Te Programming,Patrick Burns and Bill Alpert,B00APEV988,,yellow,,location,1131
"If you are embarking on a big project, then the first thing on the agenda should be to look for roadblocks. Can you get from one end to the other? This requires an anti-procrastination strategy --- you need to investigate all the hard problems to make sure they really are tractable.",Tao Te Programming,Patrick Burns and Bill Alpert,B00APEV988,look at the hard problems early and make sure they are really tractable,yellow,,location,1126
You can write ugly in any language. Try to stick to the strengths of the language you are using.,Tao Te Programming,Patrick Burns and Bill Alpert,B00APEV988,,yellow,,location,1295
"Sometimes if code is not passing a test, it can be the test that needs to change and not the code. I've spent a good few hours several times wondering what was wrong with my code only to come to the conclusion that the code was fine but the test was wrong.",Tao Te Programming,Patrick Burns and Bill Alpert,B00APEV988,,yellow,,location,1239
"If a bug is found, add a test triggering that bug to your standard test suite. Then of course, fix the bug.",Tao Te Programming,Patrick Burns and Bill Alpert,B00APEV988,,yellow,,location,1266
"Quality begets quality. If your code is clean, then code that touches your code can be clean. If your code is dirty, then code has to contort itself to use your dirty code. Much more importantly: elegant code inspires",Tao Te Programming,Patrick Burns and Bill Alpert,B00APEV988,,yellow,,location,1311
"If you can't easily explain how to use the code, then change the code. If you can't explain it and you wrote it, how do you expect a user to understand it properly? The best way to know if you can explain the code is to write the documentation.",Tao Te Programming,Patrick Burns and Bill Alpert,B00APEV988,,yellow,,location,1214
The best way to deliver code that is right is to try your hardest to prove that it isn't. Test suites are the best hope there is of producing high quality code. There is a philosophy that has the axiom: A bug is a test you forgot to write.,Tao Te Programming,Patrick Burns and Bill Alpert,B00APEV988,,yellow,,location,1221
"A universe that fills with workarounds is in a death spiral. Workarounds for workarounds are a particular warning sign. Workarounds are easily born, and hard to kill. Workarounds are maybe the place where comments are most useful. Document a workaround in the code: highlight the limits of the workaround state precisely what the problem code is state precisely the problem with the problem code give a test that shows when the workaround can be removed",Tao Te Programming,Patrick Burns and Bill Alpert,B00APEV988,comment heavily when using workarounds,yellow,,location,1153
"The game of checkers (a.k.a. draughts) has the notion of ""kinging"" a piece, after which the piece has more freedom of motion. Examples propel your users out of confusion. Good examples are gold.",Tao Te Programming,Patrick Burns and Bill Alpert,B00APEV988,,yellow,,location,1203
Some problems are common. Look out for: off-by-one bugs first-only bugs (doesn't work the first time but does thereafter; or works the first time and broken after),Tao Te Programming,Patrick Burns and Bill Alpert,B00APEV988,,yellow,,location,1237
"Ultimately, that process of going through and thinking about what's the purpose of this slide, what it does, is it makes your talk much more focused. There are no extra pieces that end up on each slide, or at least that's the goal because you're forced to wrestle with each slide. I think it’s very helpful from that standpoint of helping the presenter to create an argument that's very tight and very precise.",Rethinking PowerPoint: Interviews With The World's Leading Presentation Experts,Ron Galloway,B004WPPG30,,yellow,,location,662
"the overall structure isn't a beginning, a middle, and an end. In other words, you break down your material into episodes so that you have bite size material that has it’s own structure, it’s own rhythm. Each episode is more interesting than the one before and that kind of entices you to continue.",Rethinking PowerPoint: Interviews With The World's Leading Presentation Experts,Ron Galloway,B004WPPG30,,yellow,,location,424
It’s finding that sweet spot between too much information and too little information. That’s the real art of storytelling,Rethinking PowerPoint: Interviews With The World's Leading Presentation Experts,Ron Galloway,B004WPPG30,,yellow,,location,504
"You are continually creating and resolving tension for your audience. It makes for a flow of presentation that is very different from the sort of more logical, structured, boring approach that we typically use. Instead the approach is to raise a problem that your audience has, resolve that problem, raise another one, resolve that, raise a reaction or a comeback, resolve that and just keep flowing that way.",Rethinking PowerPoint: Interviews With The World's Leading Presentation Experts,Ron Galloway,B004WPPG30,,yellow,,location,451
