Highlight,Book Title,Book Author,Amazon Book ID,Note,Color,Tags,Location Type,Location
"a system that is designed to handle 100,000 requests per second, each 1 kB in size, looks very different from a system that is designed for 3 requests per minute, each 2 GB in size — even though the two systems have the same data throughput. An architecture that scales well for a particular application is built around assumptions of which operations will be common and which will be rare — the load parameters.","Designing Data-Intensive Applications: The Big Ideas Behind Reliable, Scalable, and Maintainable Systems",Martin Kleppmann,B06XPJML5D,,yellow,,location,537
"Even if you make the calls in parallel, the end-user request still needs to wait for the slowest of the parallel calls to complete. It takes just one slow call to make the entire end-user request slow, as illustrated in Figure 1-5. Even if only a small percentage of backend calls are slow, the chance of getting a slow call increases if an end-user request requires multiple backend calls, and so a higher proportion of end-user requests end up being slow (an effect known as tail latency amplification","Designing Data-Intensive Applications: The Big Ideas Behind Reliable, Scalable, and Maintainable Systems",Martin Kleppmann,B06XPJML5D,,yellow,,location,489
"High percentiles of response times, also known as tail latencies, are important because they directly affect users’ experience of the service.","Designing Data-Intensive Applications: The Big Ideas Behind Reliable, Scalable, and Maintainable Systems",Martin Kleppmann,B06XPJML5D,,yellow,,location,459
"majority of the cost of software is not in its initial development, but in its ongoing maintenance — fixing bugs, keeping its systems operational, investigating failures, adapting it to new platforms, modifying it for new use cases, repaying technical debt, and adding new features.","Designing Data-Intensive Applications: The Big Ideas Behind Reliable, Scalable, and Maintainable Systems",Martin Kleppmann,B06XPJML5D,,yellow,,location,547
"You can look at it in two ways: When you increase a load parameter and keep the system resources (CPU, memory, network bandwidth, etc.) unchanged, how is the performance of your system affected? When you increase a load parameter, how much do you need to increase the resources if you want to keep performance unchanged?","Designing Data-Intensive Applications: The Big Ideas Behind Reliable, Scalable, and Maintainable Systems",Martin Kleppmann,B06XPJML5D,,yellow,,location,414
"Queueing delays often account for a large part of the response time at high percentiles. As a server can only process a small number of things in parallel (limited, for example, by its number of CPU cores), it only takes a small number of slow requests to hold up the processing of subsequent requests — an effect sometimes known as head-of-line blocking","Designing Data-Intensive Applications: The Big Ideas Behind Reliable, Scalable, and Maintainable Systems",Martin Kleppmann,B06XPJML5D,,yellow,,location,478
"pay particular attention to three design principles for software systems: Operability Make it easy for operations teams to keep the system running smoothly. Simplicity Make it easy for new engineers to understand the system, by removing as much complexity as possible from the system. (Note this is not the same as simplicity of the user interface.) Evolvability Make it easy for engineers to make changes to the system in the future, adapting it for unanticipated use cases as requirements change. Also known as extensibility, modifiability, or plasticity.","Designing Data-Intensive Applications: The Big Ideas Behind Reliable, Scalable, and Maintainable Systems",Martin Kleppmann,B06XPJML5D,,yellow,,location,554
architecture that scales well for a particular application is built around assumptions of which operations will be common and which will be rare — the load parameters.,"Designing Data-Intensive Applications: The Big Ideas Behind Reliable, Scalable, and Maintainable Systems",Martin Kleppmann,B06XPJML5D,,yellow,,location,538
"Scalability is the term we use to describe a system’s ability to cope with increased load. Note, however, that it is not a one-dimensional label that we can attach to a system: it is meaningless to say “X is scalable” or “Y doesn’t scale.” Rather, discussing scalability means considering questions like “If the system grows in a particular way, what are our options for coping with the growth?” and “How can we add computing resources to handle the additional load?”","Designing Data-Intensive Applications: The Big Ideas Behind Reliable, Scalable, and Maintainable Systems",Martin Kleppmann,B06XPJML5D,,yellow,,location,361
"Describing Performance Once you have described the load on your system, you can investigate what happens when the load increases. You can look at it in two ways: When you increase a load parameter and keep the system resources (CPU, memory, network bandwidth, etc.) unchanged, how is the performance of your system affected? When you increase a load parameter, how much do you need to increase the resources if you want to keep performance unchanged?","Designing Data-Intensive Applications: The Big Ideas Behind Reliable, Scalable, and Maintainable Systems",Martin Kleppmann,B06XPJML5D,,yellow,,location,411
"Allow quick and easy recovery from human errors, to minimize the impact in the case of a failure. For example, make it fast to roll back configuration changes, roll out new code gradually (so that any unexpected bugs affect only a small subset of users), and provide tools to recompute data (in case it turns out that the old computation was incorrect).","Designing Data-Intensive Applications: The Big Ideas Behind Reliable, Scalable, and Maintainable Systems",Martin Kleppmann,B06XPJML5D,,yellow,,location,336
"Design systems in a way that minimizes opportunities for error. For example, well-designed abstractions, APIs, and admin interfaces make it easy to do “the right thing” and discourage “the wrong thing.” However, if the interfaces are too restrictive people will work around them, negating their benefit, so this is a tricky balance to get right.","Designing Data-Intensive Applications: The Big Ideas Behind Reliable, Scalable, and Maintainable Systems",Martin Kleppmann,B06XPJML5D,,yellow,,location,329
"we need to succinctly describe the current load on the system; only then can we discuss growth questions (what happens if our load doubles?). Load can be described with a few numbers which we call load parameters. The best choice of parameters depends on the architecture of your system: it may be requests per second to a web server, the ratio of reads to writes in a database, the number of simultaneously active users in a chat room, the hit rate on a cache, or something else. Perhaps the average case is what matters for you, or perhaps your bottleneck is dominated by a small number of extreme cases.","Designing Data-Intensive Applications: The Big Ideas Behind Reliable, Scalable, and Maintainable Systems",Martin Kleppmann,B06XPJML5D,,yellow,,location,367
Decouple the places where people make the most mistakes from the places where they can cause failures.,"Designing Data-Intensive Applications: The Big Ideas Behind Reliable, Scalable, and Maintainable Systems",Martin Kleppmann,B06XPJML5D,,yellow,,location,331
"Set up detailed and clear monitoring, such as performance metrics and error rates. In other engineering disciplines this is referred to as telemetry. (Once a rocket has left the ground, telemetry is essential for tracking what is happening, and for understanding failures [14].) Monitoring can show us early warning signals and allow us to check whether any assumptions or constraints are being violated. When a problem occurs, metrics can be invaluable in diagnosing the issue.","Designing Data-Intensive Applications: The Big Ideas Behind Reliable, Scalable, and Maintainable Systems",Martin Kleppmann,B06XPJML5D,,yellow,,location,340
"The central feature of Bayesian inference, the directquantification of uncertainty, means that there is no impediment in principle to fittingmodels with many parameters and complicated multilayered probability specifications.","Bayesian Data Analysis, Third Edition (Chapman & Hall/CRC Texts in Statistical Science)","Andrew Gelman, John B. Carlin, Hal S. Stern, David B. Dunson, Aki Vehtari, and Donald B. Rubin",B00I60M6H6,,yellow,,location,8302
"In order to make probability statements aboutθgiven y, we must begin with a modelproviding a joint probability distribution forθand y. The joint probability mass or densityfunction can be written as a product of two densities that are often referred to as the priordistribution p(θ) and the sampling distribution (or data distribution) p( y|θ), respectively:p(θ, y) = p(θ) p( y|θ).","Bayesian Data Analysis, Third Edition (Chapman & Hall/CRC Texts in Statistical Science)","Andrew Gelman, John B. Carlin, Hal S. Stern, David B. Dunson, Aki Vehtari, and Donald B. Rubin",B00I60M6H6,,yellow,,location,9179
"We also occasionally use the following expressions for all-positive random variablesθ:the coefficient of variation is defined as sd(θ) /E(θ), the geometric mean is exp(E[log(θ)]),and the geometric standard deviation is exp(sd[log(θ)]).","Bayesian Data Analysis, Third Edition (Chapman & Hall/CRC Texts in Statistical Science)","Andrew Gelman, John B. Carlin, Hal S. Stern, David B. Dunson, Aki Vehtari, and Donald B. Rubin",B00I60M6H6,,yellow,,location,9179
"A pragmatic rationale for the use of Bayesian methods is the inherent flexibility introducedby their incorporation of multiple levels of randomness and the resultant ability to combineinformation from different sources, while incorporating all reasonable sources of uncertaintyin inferential summaries. Such methods naturally lead to smoothed estimates in complicateddata structures and consequently have the ability to obtain better real-world answers.","Bayesian Data Analysis, Third Edition (Chapman & Hall/CRC Texts in Statistical Science)","Andrew Gelman, John B. Carlin, Hal S. Stern, David B. Dunson, Aki Vehtari, and Donald B. Rubin",B00I60M6H6,,yellow,,location,17042
"where p( y) =Pθp(θ) p( y|θ), and the sum is over all possible values ofθ(or p( y) = Rp(θ) p( y|θ) dθin the case of continuousθ). An equivalent form of (1.1) omits the factor p( y), which does not depend onθand, with fixed y, can thus be considered a constant,yielding the unnormalized posterior density, which is the right side of (1.2):","Bayesian Data Analysis, Third Edition (Chapman & Hall/CRC Texts in Statistical Science)","Andrew Gelman, John B. Carlin, Hal S. Stern, David B. Dunson, Aki Vehtari, and Donald B. Rubin",B00I60M6H6,,yellow,,location,9613
"When using a standard distribution, we use a notation basedon the name of the distribution; for example, ifθhas a normal distribution with meanµ and varianceσ2, we writeθ∼N(µ, σ2) or p(θ) = N(θ|µ, σ2) or, to be even moreexplicit, p(θ|µ, σ2) = N(θ|µ, σ2).","Bayesian Data Analysis, Third Edition (Chapman & Hall/CRC Texts in Statistical Science)","Andrew Gelman, John B. Carlin, Hal S. Stern, David B. Dunson, Aki Vehtari, and Donald B. Rubin",B00I60M6H6,,yellow,,location,9178
"Simply conditioning on the known value of the data y, using the basic property of conditionalprobability known as Bayes’ rule, yields the posterior density:p(θ|y) =p(θ, y)p( y)=p(θ) p( y|θ)p( y),","Bayesian Data Analysis, Third Edition (Chapman & Hall/CRC Texts in Statistical Science)","Andrew Gelman, John B. Carlin, Hal S. Stern, David B. Dunson, Aki Vehtari, and Donald B. Rubin",B00I60M6H6,,yellow,,location,9612
The guiding principle is that the stateof knowledge about anything unknown is described by a probability distribution.,"Bayesian Data Analysis, Third Edition (Chapman & Hall/CRC Texts in Statistical Science)","Andrew Gelman, John B. Carlin, Hal S. Stern, David B. Dunson, Aki Vehtari, and Donald B. Rubin",B00I60M6H6,,yellow,,location,11797
"Statistical inference is concerned with drawing conclusions, from numerical data, aboutquantities that are not observed. For example, a clinical trial of a new cancer drug mightbe designed to compare the five-year survival probability in a population given the new drugto that in a population under standard treatment. These survival probabilities refer to alarge population of patients, and it is neither feasible nor ethically acceptable to experimenton an entire population. Therefore inferences about the true probabilities and, in particular,their differences must be based on a sample of patients. In this example, even if it werepossible to expose the entire population to one or the other treatment, it is never possible toexpose anyone to both treatments, and therefore statistical inference would still be needed toassess the causal inference—the comparison between the observed outcome in each patientand that patient’s unobserved outcome if exposed to the other treatment.","Bayesian Data Analysis, Third Edition (Chapman & Hall/CRC Texts in Statistical Science)","Andrew Gelman, John B. Carlin, Hal S. Stern, David B. Dunson, Aki Vehtari, and Donald B. Rubin",B00I60M6H6,,yellow,,location,8303
"It is at the fundamentallevel of conditioning on observed data that Bayesian inference departs from the approachto statistical inference described in many textbooks, which is based on a retrospective evaluation of the procedure used to estimateθ(or ˜y) over the distribution of possible y valuesconditional on the true unknown value ofθ.","Bayesian Data Analysis, Third Edition (Chapman & Hall/CRC Texts in Statistical Science)","Andrew Gelman, John B. Carlin, Hal S. Stern, David B. Dunson, Aki Vehtari, and Donald B. Rubin",B00I60M6H6,,blue,blue,location,9176
"a Bayesian (probability) interval foran unknown quantity of interest can be directly regarded as having a high probability ofcontaining the unknown quantity, in contrast to a frequentist (confidence) interval, whichmay strictly be interpreted only in relation to a sequence of similar inferences that mightbe made in repeated practice.","Bayesian Data Analysis, Third Edition (Chapman & Hall/CRC Texts in Statistical Science)","Andrew Gelman, John B. Carlin, Hal S. Stern, David B. Dunson, Aki Vehtari, and Donald B. Rubin",B00I60M6H6,,yellow,,location,7867
A primary motivation for Bayesian thinking is that it facilitates a common-sense interpretation of statistical conclusions.,"Bayesian Data Analysis, Third Edition (Chapman & Hall/CRC Texts in Statistical Science)","Andrew Gelman, John B. Carlin, Hal S. Stern, David B. Dunson, Aki Vehtari, and Donald B. Rubin",B00I60M6H6,,yellow,,location,7867
"the likelihood principle, which states that for a given sample of data, any two probabilitymodels p( y|θ) that have the same likelihood function yield the same inference forθ.","Bayesian Data Analysis, Third Edition (Chapman & Hall/CRC Texts in Statistical Science)","Andrew Gelman, John B. Carlin, Hal S. Stern, David B. Dunson, Aki Vehtari, and Donald B. Rubin",B00I60M6H6,,yellow,,location,10049
"Using Bayes’ rule with a chosen probability model means that the data y affect the posteriorinference (1.2) only through p( y|θ), which, when regarded as a function ofθ, for fixed y, iscalled the likelihood function.","Bayesian Data Analysis, Third Edition (Chapman & Hall/CRC Texts in Statistical Science)","Andrew Gelman, John B. Carlin, Hal S. Stern, David B. Dunson, Aki Vehtari, and Donald B. Rubin",B00I60M6H6,,yellow,,location,9615
p(θ|y)∝p(θ) p( y|θ).,"Bayesian Data Analysis, Third Edition (Chapman & Hall/CRC Texts in Statistical Science)","Andrew Gelman, John B. Carlin, Hal S. Stern, David B. Dunson, Aki Vehtari, and Donald B. Rubin",B00I60M6H6,,yellow,,location,9613
"The second term in this expression, p( y|θ), is taken here as a function ofθ, not of y. Thesesimple formulas encapsulate the technical core of Bayesian inference: the primary task ofany specific application is to develop the model p(θ, y) and perform the computations tosummarize p(θ|y) in appropriate ways.","Bayesian Data Analysis, Third Edition (Chapman & Hall/CRC Texts in Statistical Science)","Andrew Gelman, John B. Carlin, Hal S. Stern, David B. Dunson, Aki Vehtari, and Donald B. Rubin",B00I60M6H6,,yellow,,location,9613
"In Bayesian statistics, probability is used as the fundamental measure or yardstick ofuncertainty.","Bayesian Data Analysis, Third Edition (Chapman & Hall/CRC Texts in Statistical Science)","Andrew Gelman, John B. Carlin, Hal S. Stern, David B. Dunson, Aki Vehtari, and Donald B. Rubin",B00I60M6H6,,yellow,,location,11364
"These probability statements are conditional on the observed value of y, and in our notation are written simply as p(θ|y) or p(˜y|y).","Bayesian Data Analysis, Third Edition (Chapman & Hall/CRC Texts in Statistical Science)","Andrew Gelman, John B. Carlin, Hal S. Stern, David B. Dunson, Aki Vehtari, and Donald B. Rubin",B00I60M6H6,,yellow,,location,9176
"We alsoimplicitly condition on the known values of any covariates, x.","Bayesian Data Analysis, Third Edition (Chapman & Hall/CRC Texts in Statistical Science)","Andrew Gelman, John B. Carlin, Hal S. Stern, David B. Dunson, Aki Vehtari, and Donald B. Rubin",B00I60M6H6,,yellow,,location,9176
our view of an applied Bayesian statistician is one who is willing toapply Bayes’ rule under a variety of possible models.,"Bayesian Data Analysis, Third Edition (Chapman & Hall/CRC Texts in Statistical Science)","Andrew Gelman, John B. Carlin, Hal S. Stern, David B. Dunson, Aki Vehtari, and Donald B. Rubin",B00I60M6H6,,orange,orange,location,10050
"Bayesian statistical conclusions about a parameterθ, or unobserved data ˜y, are made interms of probability statements.","Bayesian Data Analysis, Third Edition (Chapman & Hall/CRC Texts in Statistical Science)","Andrew Gelman, John B. Carlin, Hal S. Stern, David B. Dunson, Aki Vehtari, and Donald B. Rubin",B00I60M6H6,,yellow,,location,9176
"Edward Tufte refers to an important principle, called “the smallest effective difference,” that is in harmony with SNR. “Make all visual distinctions as subtle as possible,” says Tufte, “but still clear and effective.” If the message can be designed with fewer elements, then there is no point in using more.",Presentation Zen: Simple Ideas on Presentation Design and Delivery (Voices That Matter),Garr Reynolds,B006R4H5FG,,yellow,favorite,location,1575
"To some people, simple means a kind of oversimplification of an issue, which ignores complexities and creates obfuscation and outright falsehoods. Politicians are often guilty of this type of oversimplification. But this is not the kind of simplicity I am talking about. The kind of simplicity I mean does not come from a place of laziness or ignorance; rather, it comes from an intelligent desire for clarity that gets to the essence of an issue, which is not easy to do.",Presentation Zen: Simple Ideas on Presentation Design and Delivery (Voices That Matter),Garr Reynolds,B006R4H5FG,,yellow,,location,1315
"These four principles—contrast, repetition, alignment, and proximity—are not all there is to know about graphic design. But, understanding these simple, related concepts and applying them to slide design can make for far more satisfying and effective designs.",Presentation Zen: Simple Ideas on Presentation Design and Delivery (Voices That Matter),Garr Reynolds,B006R4H5FG,,yellow,,location,1907
"Basic elements to include in your story: 1. Identify the problem. (This could be a problem, for example, that your product solves.) 2. Identify causes of the problem. (Give actual examples of the conflict surrounding the problem.) 3. Show how and why you solved the problem. (This is where you provide resolution to the conflict.)",Presentation Zen: Simple Ideas on Presentation Design and Delivery (Voices That Matter),Garr Reynolds,B006R4H5FG,,yellow,,location,1012
"Technologies such as PowerPoint and Keynote—and new tools such as Prezi—are only useful to the degree that they make things clearer and more memorable, and strengthen the human-to-human connection that is the basis of communication.",Presentation Zen: Simple Ideas on Presentation Design and Delivery (Voices That Matter),Garr Reynolds,B006R4H5FG,,yellow,,location,212
"The principles I am most mindful of through every step of the presentation process are restraint, simplicity, and naturalness: Restraint in preparation. Simplicity in design. Naturalness in delivery.",Presentation Zen: Simple Ideas on Presentation Design and Delivery (Voices That Matter),Garr Reynolds,B006R4H5FG,,yellow,,location,152
"When we design, we need to be concerned with how other people interpret our design solutions and messages.",Presentation Zen: Simple Ideas on Presentation Design and Delivery (Voices That Matter),Garr Reynolds,B006R4H5FG,,yellow,,location,1544
"“Never, ever hand out copies of your slides, and certainly not before your presentation. That is the kiss of death. By definition, since slides are speaker support material, they are there in support of the speaker... YOU. As such, they should be completely incapable of standing by themselves, and are thus useless to give to your audience, where they will simply be guaranteed to be a distraction. The flip side of this is that if the slides can stand by themselves, why the heck are you up there in front of them?” —David S. Rose",Presentation Zen: Simple Ideas on Presentation Design and Delivery (Voices That Matter),Garr Reynolds,B006R4H5FG,,yellow,,location,797
Design is about making conscious decisions about inclusion and exclusion.,Presentation Zen: Simple Ideas on Presentation Design and Delivery (Voices That Matter),Garr Reynolds,B006R4H5FG,,yellow,,location,1551
"tips from kamishibai that we can apply to our presentations today: 1. Visuals should be big, bold, clear, and easy to see. 2. Allow graphic elements to fill the frame and bleed off the edges. 3. Use visuals in an active way, not a decorative one. 4. Aim to carefully trim back the details. 5. Make your presentation—visuals and narration—participatory.",Presentation Zen: Simple Ideas on Presentation Design and Delivery (Voices That Matter),Garr Reynolds,B006R4H5FG,,yellow,,location,1055
"“Kamishibai pictures are designed to be seen only for a few [moments], so extraneous details detract from the story and open up the possibilities of misinterpretation.”",Presentation Zen: Simple Ideas on Presentation Design and Delivery (Voices That Matter),Garr Reynolds,B006R4H5FG,,yellow,,location,1050
"People prefer to present only the rosy (and boring) picture. “But as a storyteller, you want to position the problems in the foreground and then show how you’ve overcome them,” says McKee. If you tell the story of how you struggled with antagonists, the audience is engaged with you and your material.",Presentation Zen: Simple Ideas on Presentation Design and Delivery (Voices That Matter),Garr Reynolds,B006R4H5FG,,yellow,,location,997
is about the transfer of emotion.,Presentation Zen: Simple Ideas on Presentation Design and Delivery (Voices That Matter),Garr Reynolds,B006R4H5FG,,yellow,,location,334
"The biggest element a story has, then, is conflict. Conflict is dramatic. At its core, story is about a conflict between our expectations and cold reality.",Presentation Zen: Simple Ideas on Presentation Design and Delivery (Voices That Matter),Garr Reynolds,B006R4H5FG,,yellow,,location,994
"Ensuring the highest possible signal-to-noise ratio means communicating (designing) clearly with as little degradation to the message as possible. You can degrade the visual message in many ways, including selecting inappropriate charts, using ambiguous labels and icons, and unnecessarily emphasizing items such as lines, shapes, symbols, and logos that do not play a key role in support of the message.",Presentation Zen: Simple Ideas on Presentation Design and Delivery (Voices That Matter),Garr Reynolds,B006R4H5FG,,yellow,,location,1569
"One way to activate empty space and create a dynamic, asymmetrical slide is to use large images that bleed off the edge.",Presentation Zen: Simple Ideas on Presentation Design and Delivery (Voices That Matter),Garr Reynolds,B006R4H5FG,,yellow,,location,1875
"A presentation is an opportunity to differentiate yourself, your organization, or your cause.",Presentation Zen: Simple Ideas on Presentation Design and Delivery (Voices That Matter),Garr Reynolds,B006R4H5FG,,orange,orange,location,479
"typical PowerPoint presentation in which leaders build their case with statistics and data. But people are not moved by statistics alone, nor do they always trust your data.",Presentation Zen: Simple Ideas on Presentation Design and Delivery (Voices That Matter),Garr Reynolds,B006R4H5FG,,yellow,,location,984
"And this is the most fundamental question of all, stripped down to its essence:",Presentation Zen: Simple Ideas on Presentation Design and Delivery (Voices That Matter),Garr Reynolds,B006R4H5FG,,yellow,,location,748
"the fact that information usually can be taken in faster by reading—but a necessary depth and richness is often missing. Part of the effectiveness of a presentation is the visual impact and the show-and-tell aspect of it. The presentation visuals, the structure, and the story are compelling aspects of a presentation,",Presentation Zen: Simple Ideas on Presentation Design and Delivery (Voices That Matter),Garr Reynolds,B006R4H5FG,,yellow,,location,224
