Highlight,Book Title,Book Author,Amazon Book ID,Note,Color,Tags,Location Type,Location
"Do remember to be kind. It’s natural and perfectly human to want to be liked by other people. Many of us believe that the way to be liked is to be seen as nice — that niceness is itself the goal. Your goal as a manager, however, should not be to be nice, it should be to be kind. “Nice” is the language of polite society, where you’re trying to get along with strangers or acquaintances. Nice is saying “please” and “thank you” and holding doors for people struggling with bags or strollers. Nice is saying “I’m fine” when asked how you are, instead of “I’m in a really crappy mood and I wish you would leave me alone.” Nice is a good thing in casual conversation. But as a manager, you will have relationships that go deeper, and it’s more important to be kind. It’s kind to tell someone who isn’t ready for promotion that she isn’t ready, and back that up with the work she needs to do to get there. It’s unkind to lead that person on, saying “Maybe you could get promoted,” and then watch her fail. It’s kind to tell someone that his behavior in meetings is disrupting the group. It’s awkward, and uncomfortable, but it’s also part of your job as his manager to have these difficult conversations.",The Manager's Path: A Guide for Tech Leaders Navigating Growth and Change,Camille Fournier,B06XP3GJ7F,,yellow,,location,1888
"Developing basic standards as a team helps everyone communicate with one another in code and design reviews, and it depersonalizes the process of providing technical feedback. For me, basic standards meant things like how much unit testing we expected to happen with each change (generally speaking, as some tests were always required), and at what point technical decisions should be reviewed by a larger group (like when someone wants to add a new language or framework to the stack). As with goal setting, putting standards in place here helps people know which details are important to think about when they’re creating the technology.",The Manager's Path: A Guide for Tech Leaders Navigating Growth and Change,Camille Fournier,B06XP3GJ7F,,yellow,,location,1311
"Start mastering the “yes, and” strategy for saying no, particularly when interacting with your boss and peers, and see how it often transforms contentious disagreements into realistic negotiations for priority.",The Manager's Path: A Guide for Tech Leaders Navigating Growth and Change,Camille Fournier,B06XP3GJ7F,,yellow,,location,2321
"Autonomy, the ability to have control over some part of your work, is an important element of motivation. This is why micromanagers find it so difficult to retain great teams. When you strip creative and talented people of their autonomy, they lose motivation very quickly. There’s nothing worse than feeling like you can’t make a single decision on your own, or feeling like every single piece of work you do has to be double- and triple-checked by your manager.",The Manager's Path: A Guide for Tech Leaders Navigating Growth and Change,Camille Fournier,B06XP3GJ7F,,yellow,,location,1272
"Don’t rely exclusively on consensus or voting. Consensus can appear morally authoritative, but that assumes that everyone involved in the voting process is impartial, has an equal stake in the various outcomes, and has equal knowledge of the context.",The Manager's Path: A Guide for Tech Leaders Navigating Growth and Change,Camille Fournier,B06XP3GJ7F,,yellow,,location,1863
"When you feel like you want to micromanage, ask the team how they’re measuring their success and ask them to make that visible to you on an ongoing basis. Then sit on your hands if you must, but wait a week or two to see what they give you. If they have nothing to share, it’s a sign that you may need to do a course correction, which probably means digging into more details.",The Manager's Path: A Guide for Tech Leaders Navigating Growth and Change,Camille Fournier,B06XP3GJ7F,,yellow,,location,1283
Teams often fail because they overworked themselves on a feature that their product manager would have been willing to compromise,The Manager's Path: A Guide for Tech Leaders Navigating Growth and Change,Camille Fournier,B06XP3GJ7F,,yellow,,location,758
"Listening is a precursor to empathy, which is one of the core skills of a quality manager.",The Manager's Path: A Guide for Tech Leaders Navigating Growth and Change,Camille Fournier,B06XP3GJ7F,,yellow,,location,383
"Your manager should be the person who shows you the larger picture of how your work fits into the team’s goals, and helps you feel a sense of purpose in the day-to-day work.",The Manager's Path: A Guide for Tech Leaders Navigating Growth and Change,Camille Fournier,B06XP3GJ7F,,yellow,,location,217
"you can’t make a good prediction, it is very often harmful to pretend that you can.",The Signal and the Noise: Why So Many Predictions Fail-but Some Don't,Nate Silver,B007V65R54,,yellow,,location,3842
Stress Management and Humility,The Signal and the Noise: Why So Many Predictions Fail-but Some Don't,Nate Silver,B007V65R54,,yellow,,location,1764
"Michael A. Babyak, “What You See May Not Be What You Get: A Brief, Nontechnical Introduction to Overfitting in Regression-Type Models,” Psychosomatic Medicine 66 (February 19, 2004). http://os1.amc.nl/mediawiki/images/Babyak_-_overfitting.pdf.",The Signal and the Noise: Why So Many Predictions Fail-but Some Don't,Nate Silver,B007V65R54,,yellow,,location,8196
"Perhaps the bigger problem from a statistical standpoint, however, is that precise predictions aren’t really possible to begin with when you are extrapolating on an exponential scale.",The Signal and the Noise: Why So Many Predictions Fail-but Some Don't,Nate Silver,B007V65R54,,yellow,,location,3569
"The 1970s were the high point for “vast amounts of theory applied to extremely small amounts of data,” as Paul Krugman put it to me. We had begun to use computers to produce models of the world, but it took us some time to recognize how crude and assumption laden they were, and that the precision that computers were capable of was no substitute for predictive accuracy.",The Signal and the Noise: Why So Many Predictions Fail-but Some Don't,Nate Silver,B007V65R54,,yellow,,location,270
improved technology did not cover for the lack of theoretical understanding about the economy; it only gave economists faster and more elaborate ways to mistake noise for a signal.,The Signal and the Noise: Why So Many Predictions Fail-but Some Don't,Nate Silver,B007V65R54,,yellow,,location,3309
"“modeling for insights.” That is, the agent-based models might help us to perform experiments that can teach us about infectious disease, but they are unlikely to help us predict an outbreak—for now.",The Signal and the Noise: Why So Many Predictions Fail-but Some Don't,Nate Silver,B007V65R54,,yellow,,location,3827
There is a technical term for this type of problem: the events these forecasters were considering were out of sample.,The Signal and the Noise: Why So Many Predictions Fail-but Some Don't,Nate Silver,B007V65R54,,yellow,,location,867
"Extrapolation is a very basic method of prediction—usually, much too basic. It simply involves the assumption that the current trend will continue indefinitely, into the future.",The Signal and the Noise: Why So Many Predictions Fail-but Some Don't,Nate Silver,B007V65R54,,yellow,,location,3539
"If you’re using a biased instrument, it doesn’t matter how many measurements you take—you’re aiming at the wrong target.",The Signal and the Noise: Why So Many Predictions Fail-but Some Don't,Nate Silver,B007V65R54,,yellow,,location,4216
my view is that a certain amount of immersion in a topic will provide disproportionately more insight than an executive summary.,The Signal and the Noise: Why So Many Predictions Fail-but Some Don't,Nate Silver,B007V65R54,,yellow,,location,412
cases of progress in forecasting must be weighed against a series of failures.,The Signal and the Noise: Why So Many Predictions Fail-but Some Don't,Nate Silver,B007V65R54,,yellow,,location,320
"Heuristics are very useful things, but they necessarily produce biases and blind spots.",The Signal and the Noise: Why So Many Predictions Fail-but Some Don't,Nate Silver,B007V65R54,,yellow,,location,4439
"This is the essence of Beane’s philosophy: collect as much information as possible, but then be as rigorous and disciplined as possible when analyzing it.",The Signal and the Noise: Why So Many Predictions Fail-but Some Don't,Nate Silver,B007V65R54,,yellow,,location,1807
"Our brains, wired to detect patterns, are always looking for a signal, when instead we should appreciate how noisy the data is.",The Signal and the Noise: Why So Many Predictions Fail-but Some Don't,Nate Silver,B007V65R54,,yellow,,location,1188
"One way to judge a forecast, Murphy wrote—perhaps the most obvious one—was through what he called “quality,” but which might be better defined as accuracy.",The Signal and the Noise: Why So Many Predictions Fail-but Some Don't,Nate Silver,B007V65R54,,yellow,,location,2266
"What happens in systems with noisy data and underdeveloped theory—like earthquake prediction and parts of economics and political science—is a two-step process. First, people start to mistake the noise for a signal. Second, this noise pollutes journals, blogs, and news accounts with false alarms, undermining good science and setting back our ability to understand how the system really works.",The Signal and the Noise: Why So Many Predictions Fail-but Some Don't,Nate Silver,B007V65R54,,yellow,,location,2788
"Regulation is one approach to solving these problems. But I am suspicious that it is an excuse to avoid looking within ourselves for answers. We need to stop, and admit it: we have a prediction problem. We love to predict things—and we aren’t very good at it.",The Signal and the Noise: Why So Many Predictions Fail-but Some Don't,Nate Silver,B007V65R54,,yellow,,location,380
"Great players like Kasparov do not delude themselves into thinking they can calculate all these possibilities. This is what separates elite players from amateurs. In his famous study of chess players, the Dutch psychologist Adriaan de Groot found that amateur players, when presented with a chess problem, often frustrated themselves by looking for the perfect move, rendering themselves incapable of making any move at all.26 Chess masters, by contrast, are looking for a good move—and certainly if at all possible the best move in a given position—but they are more forecasting how the move might favorably dispose their position than trying to enumerate every possibility.",The Signal and the Noise: Why So Many Predictions Fail-but Some Don't,Nate Silver,B007V65R54,,yellow,,location,4515
The litmus test for whether you are a competent forecaster is if more information makes your predictions better.,The Signal and the Noise: Why So Many Predictions Fail-but Some Don't,Nate Silver,B007V65R54,,yellow,,location,1808
Our first instinct is to place information into categories—usually a relatively small number of categories since they’ll be easier to keep track of. (Think of how the Census Bureau classifies people from hundreds of ethnic groups into just six racial categories or how thousands of artists are placed into a taxonomy of a few musical genres.),The Signal and the Noise: Why So Many Predictions Fail-but Some Don't,Nate Silver,B007V65R54,,yellow,,location,1837
"One of the pervasive risks that we face in the information age, as I wrote in the introduction, is that even if the amount of knowledge in the world is increasing, the gap between what we know and what we think we know may be widening.",The Signal and the Noise: Why So Many Predictions Fail-but Some Don't,Nate Silver,B007V65R54,,yellow,,location,901
"When catastrophe strikes, we look for a signal in the noise—anything that might explain the chaos that we see all around us and bring order to the world again.",The Signal and the Noise: Why So Many Predictions Fail-but Some Don't,Nate Silver,B007V65R54,,yellow,,location,2512
"In contrast, if you just look at the economy as a series of variables and equations without any underlying structure, you are almost certain to mistake noise for a signal and may delude yourself (and gullible investors) into thinking you are making good forecasts when you are not.",The Signal and the Noise: Why So Many Predictions Fail-but Some Don't,Nate Silver,B007V65R54,,yellow,,location,3270
"Nor is the frequentist method particularly objective, either in theory or in practice. Instead, it relies on a whole host of assumptions. It usually presumes that the underlying uncertainty in a measurement follows a bell-curve or normal distribution. This is often a good assumption, but not in the case of something like the variation in the stock market.",The Signal and the Noise: Why So Many Predictions Fail-but Some Don't,Nate Silver,B007V65R54,,yellow,,location,4224
"A good model can be useful even when it fails. “It should be a given that whatever forecast we make on average will be wrong,” Ozonoff told me. “So usually it’s about understanding how it’s wrong, and what to do when it’s wrong, and minimizing the cost to us when it’s wrong.”",The Signal and the Noise: Why So Many Predictions Fail-but Some Don't,Nate Silver,B007V65R54,,yellow,,location,3862
"In almost all real-world applications, however, we have to work by induction, inferring the structure from the available evidence.",The Signal and the Noise: Why So Many Predictions Fail-but Some Don't,Nate Silver,B007V65R54,,yellow,,location,2826
Finding patterns is easy in any kind of data-rich environment; that’s what mediocre gamblers do. The key is in determining whether the patterns represent noise or signal.,The Signal and the Noise: Why So Many Predictions Fail-but Some Don't,Nate Silver,B007V65R54,,yellow,,location,4018
You are most likely to overfit a model when the data is limited and noisy and when your understanding of the fundamental relationships is poor;,The Signal and the Noise: Why So Many Predictions Fail-but Some Don't,Nate Silver,B007V65R54,,yellow,,location,2826
The name overfitting comes from the way that statistical models are “fit” to match past observations. The fit can be too loose—this is called underfitting—in which case you will not be capturing as much of the signal as you could. Or it can be too tight—an overfit model—which means that you’re fitting the noise in the data rather than discovering its underlying structure. The latter error is much more common in practice.,The Signal and the Noise: Why So Many Predictions Fail-but Some Don't,Nate Silver,B007V65R54,,yellow,,location,2803
"Making a new forecast does not mean that the old forecast just disappears. (Ideally, you should keep a record of it and let people evaluate how well you did over the whole course of predicting an event.) But if you have reason to think that yesterday’s forecast was wrong, there is no glory in sticking to it.",The Signal and the Noise: Why So Many Predictions Fail-but Some Don't,Nate Silver,B007V65R54,,yellow,,location,1223
"Ultimately, the right attitude is that you should make the best forecast possible today—regardless of what you said last week, last month, or last year.",The Signal and the Noise: Why So Many Predictions Fail-but Some Don't,Nate Silver,B007V65R54,,yellow,,location,1222
"The idea behind Bayes’s theorem, however, is not that we update our probability estimates just once. Instead, we do so continuously as new evidence presents itself to us.",The Signal and the Noise: Why So Many Predictions Fail-but Some Don't,Nate Silver,B007V65R54,,yellow,,location,4139
"when we have “too much information” is to engage with it selectively, picking out the parts we like and ignoring the remainder, making allies with those who have made the same choices and enemies of the rest.",The Signal and the Noise: Why So Many Predictions Fail-but Some Don't,Nate Silver,B007V65R54,,yellow,,location,212
"Successful gamblers, instead, think of the future as speckles of probability, flickering upward and downward like a stock market ticker to every new jolt of information. When their estimates of these probabilities diverge by a sufficient margin from the odds on offer, they may place a bet.",The Signal and the Noise: Why So Many Predictions Fail-but Some Don't,Nate Silver,B007V65R54,,yellow,,location,3967
recognizing that the amount of confidence someone expresses in a prediction is not a good indication of its accuracy—to,The Signal and the Noise: Why So Many Predictions Fail-but Some Don't,Nate Silver,B007V65R54,,yellow,,location,3389
A second measure was what Murphy labeled “consistency” but which I think of as honesty.,The Signal and the Noise: Why So Many Predictions Fail-but Some Don't,Nate Silver,B007V65R54,,yellow,,location,2268
"in fact real management is mostly about managing coalitions, maintaining support for a project so it doesn’t evaporate.",The Signal and the Noise: Why So Many Predictions Fail-but Some Don't,Nate Silver,B007V65R54,,yellow,,location,3368
Bayes’s theorem requires us to think through these problems more carefully and can be very useful for detecting when our gut-level approximations are much too crude.,The Signal and the Noise: Why So Many Predictions Fail-but Some Don't,Nate Silver,B007V65R54,,yellow,,location,4125
"there’s a 40 percent chance of rain tomorrow, one way to interpret that is that in 40 percent of his simulations, a storm developed, and in the other 60 percent—using just slightly different initial parameters—it did not.",The Signal and the Noise: Why So Many Predictions Fail-but Some Don't,Nate Silver,B007V65R54,,yellow,,location,2141
more information actually can make matters worse for people who take the wrong attitude toward prediction and use it as an excuse to advance a partisan theory about the way that the world is supposed to work—instead of trying to get at the truth.,The Signal and the Noise: Why So Many Predictions Fail-but Some Don't,Nate Silver,B007V65R54,,yellow,,location,1656
"If you compare the number of children who are diagnosed as autistic64 to the frequency with which the term autism has been used in American newspapers,65 you’ll find that there is an almost perfect one-to-one correspondence (figure 7-4), with both having increased markedly in recent years.",The Signal and the Noise: Why So Many Predictions Fail-but Some Don't,Nate Silver,B007V65R54,,yellow,,location,3647
"this book is emphatically against the nihilistic viewpoint that there is no objective truth. It asserts, rather, that a belief in the objective truth—and a commitment to pursuing it—is the first prerequisite of making better predictions. The forecaster’s next commitment is to realize that she perceives it imperfectly.",The Signal and the Noise: Why So Many Predictions Fail-but Some Don't,Nate Silver,B007V65R54,,yellow,,location,392
"Much of the most thoughtful work on the use and abuse of statistical models and the proper role of prediction comes from people in the medical profession.88 That is not to say there is nothing on the line when an economist makes a prediction, or a seismologist does. But because of medicine’s intimate connection with life and death, doctors tend to be appropriately cautious. In their field, stupid models kill people. It has a sobering effect.",The Signal and the Noise: Why So Many Predictions Fail-but Some Don't,Nate Silver,B007V65R54,,yellow,,location,3844
"When we expand our sample to include events further apart from us in time and space, it often means that we will encounter cases in which the relationships we are studying did not hold up as well as we are accustomed to. The model will seem to be less powerful.",The Signal and the Noise: Why So Many Predictions Fail-but Some Don't,Nate Silver,B007V65R54,,yellow,,location,893
"The best forecasters, Hoke explained, need to think visually and abstractly while at the same time being able to sort through the abundance of information the computer provides them with. Moreover, they must understand the dynamic and nonlinear nature of the system they are trying to study. It is not an easy task, requiring vigorous use of both the left and right brain.",The Signal and the Noise: Why So Many Predictions Fail-but Some Don't,Nate Silver,B007V65R54,,yellow,,location,2195
"When we can’t fit a square peg into a round hole, we’ll usually blame the peg—when sometimes it’s the rigidity of our thinking that accounts for our failure to accommodate it.",The Signal and the Noise: Why So Many Predictions Fail-but Some Don't,Nate Silver,B007V65R54,,yellow,,location,1836
"We forget—or we willfully ignore—that our models are simplifications of the world. We figure that if we make a mistake, it will be at the margin.",The Signal and the Noise: Why So Many Predictions Fail-but Some Don't,Nate Silver,B007V65R54,,yellow,,location,897
"The problem, Poggio says, is that these evolutionary instincts sometimes lead us to see patterns when there are none there.",The Signal and the Noise: Why So Many Predictions Fail-but Some Don't,Nate Silver,B007V65R54,,yellow,,location,355
"When you hear on the news that GDP will grow by 2.5 percent next year, that means it could quite easily grow at a spectacular rate of 5.7 percent instead. Or it could fall by 0.7 percent—a fairly serious recession. Economists haven’t been able to do any better than that, and there isn’t much evidence that their forecasts are improving. The old joke about economists’ having called nine out of the last six recessions correctly has some truth to it; one actual statistic is that in the 1990s, economists predicted only 2 of the 60 recessions around the world a year ahead of time.21",The Signal and the Noise: Why So Many Predictions Fail-but Some Don't,Nate Silver,B007V65R54,,yellow,,location,3047
"I have emphasized throughout this book, a probabilistic consideration of outcomes is an essential part of a scientific forecast.",The Signal and the Noise: Why So Many Predictions Fail-but Some Don't,Nate Silver,B007V65R54,,yellow,,location,3017
the maxim “correlation does not imply causation.” Just because two variables have a statistical relationship with each other does not mean that one is responsible for the other.,The Signal and the Noise: Why So Many Predictions Fail-but Some Don't,Nate Silver,B007V65R54,,yellow,,location,3128
Fisherian statistical methods do not encourage us to think about which correlations imply causations and which ones do not.,The Signal and the Noise: Why So Many Predictions Fail-but Some Don't,Nate Silver,B007V65R54,,yellow,,location,4261
The alchemy that the ratings agencies performed was to spin uncertainty into what looked and felt like risk.,The Signal and the Noise: Why So Many Predictions Fail-but Some Don't,Nate Silver,B007V65R54,,yellow,,location,629
"The word objective is sometimes taken to be synonymous with quantitative, but it isn’t. Instead it means seeing beyond our personal biases and prejudices and toward the truth of a problem.43",The Signal and the Noise: Why So Many Predictions Fail-but Some Don't,Nate Silver,B007V65R54,,yellow,,location,1350
"statheads can have their biases too. One of the most pernicious ones is to assume that if something cannot easily be quantified, it does not matter.",The Signal and the Noise: Why So Many Predictions Fail-but Some Don't,Nate Silver,B007V65R54,,yellow,,location,1661
Extrapolation tends to cause its greatest problems in fields—including population growth and disease—where the quantity that you want to study is growing exponentially.,The Signal and the Noise: Why So Many Predictions Fail-but Some Don't,Nate Silver,B007V65R54,,yellow,,location,3562
(The problem with Fisher’s notion of hypothesis testing is not with having hypotheses but with the way Fisher recommends that we test them.),The Signal and the Noise: Why So Many Predictions Fail-but Some Don't,Nate Silver,B007V65R54,,yellow,,location,4286
"Uncertainty, on the other hand, is risk that is hard to measure.",The Signal and the Noise: Why So Many Predictions Fail-but Some Don't,Nate Silver,B007V65R54,,yellow,,location,625
"Calibration is difficult to achieve in many fields. It requires you to think probabilistically, something that most of us (including most “expert” forecasters) are not very good at. It really tends to punish overconfidence—a trait that most forecasters have in spades. It also requires a lot of data to evaluate fully—cases where forecasters have issued hundreds of predictions.*",The Signal and the Noise: Why So Many Predictions Fail-but Some Don't,Nate Silver,B007V65R54,,yellow,,location,2344
"Bayes’s theorem is concerned with conditional probability. That is, it tells us the probability that a theory or hypothesis is true if some event has happened.",The Signal and the Noise: Why So Many Predictions Fail-but Some Don't,Nate Silver,B007V65R54,,yellow,,location,4079
"This is the process by which modern weather forecasts are made. These small changes, introduced intentionally in order to represent the inherent uncertainty in the quality of the observational data, turn the deterministic forecast into a probabilistic one.",The Signal and the Noise: Why So Many Predictions Fail-but Some Don't,Nate Silver,B007V65R54,,yellow,,location,2139
"Needlessly complicated models may fit the noise in a problem rather than the signal, doing a poor job of replicating its underlying structure and causing predictions to be worse.",The Signal and the Noise: Why So Many Predictions Fail-but Some Don't,Nate Silver,B007V65R54,,yellow,,location,3680
